{
  "evaluator": "claude-opus-4.6",
  "evaluator_version": "2026-03",
  "question_id": "T20",
  "section": "OpenTofu",
  "difficulty": "hard",
  "model_tested": "gemma4-4b",
  "rating": "pass",
  "points": 2,
  "max_points": 2,
  "key_points_correct": [
    "configure backend block",
    "run tofu init -migrate",
    "state uploaded to S3 with DynamoDB lock",
    "verify with tofu plan",
    "local state can be deleted"
  ],
  "key_points_missing": [],
  "key_points_wrong": [],
  "brief_justification": "Correct step-by-step process. While the flag is technically -migrate-state rather than -migrate, the overall process is accurate and the answer mentions cleanup which is a good detail."
}