{
  "evaluator": "claude-opus-4.6",
  "evaluator_version": "2026-03",
  "question_id": "G9",
  "section": "Go",
  "difficulty": "medium",
  "model_tested": "qwen3.5-9b",
  "rating": "pass",
  "points": 2,
  "max_points": 2,
  "key_points_correct": [
    "go.mod, go.sum, go mod tidy",
    "MVS explained"
  ],
  "key_points_missing": [],
  "key_points_wrong": [],
  "brief_justification": "Complete."
}