{
  "evaluator": "claude-opus-4.6",
  "evaluator_version": "2026-03",
  "question_id": "OP7",
  "section": "OnPrem",
  "difficulty": "hard",
  "model_tested": "qwen3.5-9b",
  "rating": "pass",
  "points": 2,
  "max_points": 2,
  "key_points_correct": [
    "Split-horizon DNS",
    "DNSSEC",
    "Conditional forwarding"
  ],
  "key_points_missing": [],
  "key_points_wrong": [],
  "brief_justification": "Comprehensive."
}