{
  "evaluator": "claude-opus-4.6",
  "evaluator_version": "2026-03",
  "question_id": "N14",
  "section": "Networking",
  "difficulty": "easy",
  "model_tested": "gemma4-4b",
  "rating": "pass",
  "points": 2,
  "max_points": 2,
  "key_points_correct": [
    "Hub at Layer 1 broadcasts to all ports",
    "Switch at Layer 2 forwards by MAC",
    "Router at Layer 3 routes by IP"
  ],
  "key_points_missing": [],
  "key_points_wrong": [],
  "brief_justification": "Correct OSI layers and functions for all three devices."
}