{
  "evaluator": "claude-opus-4.6",
  "evaluator_version": "2026-03",
  "question_id": "P5",
  "section": "Python/.NET",
  "difficulty": "medium",
  "model_tested": "gemma4-4b",
  "rating": "pass",
  "points": 2,
  "max_points": 2,
  "key_points_correct": [
    "Generators",
    "yield",
    "yield from"
  ],
  "key_points_missing": [],
  "key_points_wrong": [],
  "brief_justification": "Complete."
}