{
  "evaluator": "claude-opus-4.6",
  "evaluator_version": "2026-03",
  "question_id": "R9",
  "section": "Rust",
  "difficulty": "hard",
  "model_tested": "qwen3.5-27b-opus",
  "rating": "pass",
  "points": 2,
  "max_points": 2,
  "key_points_correct": [
    "Future polling",
    "Executor",
    "vs Go goroutines"
  ],
  "key_points_missing": [],
  "key_points_wrong": [],
  "brief_justification": "Correct \u2014 notes cooperative vs preemptive."
}