{
  "evaluator": "claude-opus-4.6",
  "evaluator_version": "2026-03",
  "question_id": "G6",
  "section": "Go",
  "difficulty": "medium",
  "model_tested": "gemma4-4b",
  "rating": "pass",
  "points": 2,
  "max_points": 2,
  "key_points_correct": [
    "Implicit/structural interface satisfaction",
    "No implements keyword",
    "Empty interface loses type info, runtime panics possible"
  ],
  "key_points_missing": [],
  "key_points_wrong": [],
  "brief_justification": "All points correct."
}