{
  "evaluator": "claude-opus-4.6",
  "evaluator_version": "2026-03",
  "question_id": "G16",
  "section": "Go",
  "difficulty": "medium",
  "model_tested": "gemma4-4b",
  "rating": "partial",
  "points": 1,
  "max_points": 2,
  "key_points_correct": [
    "Race condition definition correct",
    "Race detector with -race flag"
  ],
  "key_points_missing": [
    "No code example -- question requires giving an example and showing fix"
  ],
  "key_points_wrong": [],
  "brief_justification": "Describes race and fix textually but does not provide the requested code example."
}