{
  "evaluator": "claude-opus-4.6",
  "evaluator_version": "2026-03",
  "question_id": "L16",
  "section": "Linux",
  "difficulty": "medium",
  "model_tested": "gemma4-4b",
  "rating": "pass",
  "points": 2,
  "max_points": 2,
  "key_points_correct": [
    "PV, VG, LV hierarchy explained",
    "LVM abstracts physical storage",
    "Extension process: lvextend then resize2fs"
  ],
  "key_points_missing": [],
  "key_points_wrong": [],
  "brief_justification": "Complete LVM explanation with correct extension procedure."
}