{
  "evaluator": "claude-opus-4.6",
  "evaluator_version": "2026-03",
  "question_id": "OP20",
  "section": "On-Prem Infrastructure",
  "difficulty": "hard",
  "model_tested": "gemma4-4b",
  "rating": "pass",
  "points": 2,
  "max_points": 2,
  "key_points_correct": [
    "802.1X roles",
    "EAP-TLS vs PEAP",
    "RADIUS",
    "Dynamic VLAN",
    "Failed auth",
    "MAB"
  ],
  "key_points_missing": [],
  "key_points_wrong": [],
  "brief_justification": "Complete."
}