{
  "evaluator": "claude-opus-4.6",
  "evaluator_version": "2026-03",
  "question_id": "T13",
  "section": "OpenTofu",
  "difficulty": "easy",
  "model_tested": "gemma4-4b",
  "rating": "pass",
  "points": 2,
  "max_points": 2,
  "key_points_correct": [
    "data source fetches existing infra info",
    "aws_ami example",
    "explains use vs managed resource"
  ],
  "key_points_missing": [],
  "key_points_wrong": [],
  "brief_justification": "Clear explanation with example."
}