{
  "evaluator": "claude-opus-4.6",
  "evaluator_version": "2026-03",
  "question_id": "D5",
  "section": "Docker/Dev",
  "difficulty": "medium",
  "model_tested": "gemma4-4b",
  "rating": "pass",
  "points": 2,
  "max_points": 2,
  "key_points_correct": [
    "Layer is read-only immutable filesystem layer",
    "Caching reuses unchanged layers",
    "Stable instructions at top, volatile at bottom"
  ],
  "key_points_missing": [],
  "key_points_wrong": [],
  "brief_justification": "Correct layer definition with caching best practice."
}