{
  "evaluator": "claude-opus-4.6",
  "evaluator_version": "2026-03",
  "question_id": "OP14",
  "section": "On-Prem Infrastructure",
  "difficulty": "easy",
  "model_tested": "gemma4-4b",
  "rating": "pass",
  "points": 2,
  "max_points": 2,
  "key_points_correct": [
    "Managed vs unmanaged",
    "Enterprise features: VLANs, QoS, LAG/LACP, port security"
  ],
  "key_points_missing": [],
  "key_points_wrong": [],
  "brief_justification": "Good features list including LACP."
}