{
  "evaluator": "claude-opus-4.6",
  "evaluator_version": "2026-03",
  "question_id": "T14",
  "section": "OpenTofu",
  "difficulty": "medium",
  "model_tested": "gemma4-4b",
  "rating": "pass",
  "points": 2,
  "max_points": 2,
  "key_points_correct": [
    "variables are external inputs",
    "locals are internal computed values",
    "use locals for complex calculations and derived values"
  ],
  "key_points_missing": [],
  "key_points_wrong": [],
  "brief_justification": "Correct distinction with good guidance."
}