{
  "evaluator": "claude-opus-4.6",
  "evaluator_version": "2026-03",
  "question_id": "N8",
  "section": "Networking",
  "difficulty": "hard",
  "model_tested": "qwen3.5-27b-opus",
  "rating": "pass",
  "points": 2,
  "max_points": 2,
  "key_points_correct": [
    "10 BGP attributes in correct order",
    "Includes eBGP over iBGP, router ID, cluster list"
  ],
  "key_points_missing": [],
  "key_points_wrong": [],
  "brief_justification": "Far exceeds the minimum 5 asked for."
}