{
  "evaluator": "claude-opus-4.6",
  "evaluator_version": "2026-03",
  "question_id": "DN11",
  "section": "Python/.NET",
  "difficulty": "easy",
  "model_tested": "gemma4-4b",
  "rating": "pass",
  "points": 2,
  "max_points": 2,
  "key_points_correct": [
    "ref, out, in correct"
  ],
  "key_points_missing": [],
  "key_points_wrong": [],
  "brief_justification": "Correct."
}