{
  "evaluator": "claude-opus-4.6",
  "evaluator_version": "2026-03",
  "question_id": "T12",
  "section": "OpenTofu",
  "difficulty": "easy",
  "model_tested": "gemma4-4b",
  "rating": "pass",
  "points": 2,
  "max_points": 2,
  "key_points_correct": [
    "destroy removes all managed resources",
    "-target flag for single resource"
  ],
  "key_points_missing": [],
  "key_points_wrong": [],
  "brief_justification": "Correct with proper -target syntax example."
}