{
  "evaluator": "claude-opus-4.6",
  "evaluator_version": "2026-03",
  "question_id": "D4",
  "section": "Docker/Dev",
  "difficulty": "medium",
  "model_tested": "gemma4-4b",
  "rating": "pass",
  "points": 2,
  "max_points": 2,
  "key_points_correct": [
    "Symmetric uses single shared key",
    "Asymmetric uses public/private key pair",
    "TLS handshake uses asymmetric to exchange symmetric session key"
  ],
  "key_points_missing": [],
  "key_points_wrong": [],
  "brief_justification": "Accurate explanation of both encryption types and their combined use in TLS."
}