{
  "evaluator": "claude-opus-4.6",
  "evaluator_version": "2026-03",
  "question_id": "G9",
  "section": "Go",
  "difficulty": "hard",
  "model_tested": "gemma4-4b",
  "rating": "partial",
  "points": 1,
  "max_points": 2,
  "key_points_correct": [
    "go.mod lists deps and versions",
    "go.sum has checksums",
    "go mod tidy cleans up"
  ],
  "key_points_missing": [],
  "key_points_wrong": [
    "MVS described as selecting highest possible version -- MVS selects MINIMUM version"
  ],
  "brief_justification": "MVS fundamentally wrong."
}