{
  "evaluator": "claude-opus-4.6",
  "evaluator_version": "2026-03",
  "question_id": "SC7",
  "section": "Scenarios",
  "difficulty": "medium",
  "model_tested": "gemma4-4b",
  "rating": "pass",
  "points": 2,
  "max_points": 2,
  "key_points_correct": [
    "Correctly explains all three drift sources and state locking dangers",
    "Pipeline with validate, plan, approval, and apply stages",
    "Uses DynamoDB for state locking with -lock=true flag",
    "Scheduled drift detection, OPA Gatekeeper, Helmfile, RBAC"
  ],
  "key_points_missing": [
    "Plan comment posting to MR uses echo placeholder instead of actual API call",
    "Plan output stored in text file instead of being parsed and posted"
  ],
  "key_points_wrong": [],
  "brief_justification": "Comprehensive drift analysis and enforcement pipeline. Pipeline structure is sound with proper manual gates and DynamoDB locking. Drift reconciliation strategy is complete."
}